{
  "protocolVersion": "0.5",
  "ownerId": "owner_fixture_01",
  "projectionName": "judgment.needs_you",
  "snapshotId": "judgment_snapshot_fixture_01",
  "snapshotBaseCursor": 20,
  "fromExclusiveCursor": 26,
  "highWaterCursor": 28,
  "nextCursor": 27,
  "items": [
    {
      "cursor": 27,
      "itemType": "judgment_request",
      "request": {
        "protocolVersion": "0.5",
        "id": "judgment_request_fixture_01",
        "ownerId": "owner_fixture_01",
        "revision": 2,
        "subject": {
          "kind": "work_unit",
          "id": "work_unit_fixture_01",
          "revision": 4
        },
        "question": {
          "ref": "judgment_question_fixture_01",
          "digest": "sha256:1111111111111111111111111111111111111111111111111111111111111111"
        },
        "options": [
          {
            "id": "option_approve",
            "authorityDisposition": "grant",
            "content": {
              "ref": "option_content_approve",
              "digest": "sha256:2222222222222222222222222222222222222222222222222222222222222222"
            }
          },
          {
            "id": "option_reject",
            "authorityDisposition": "refuse",
            "content": {
              "ref": "option_content_reject",
              "digest": "sha256:3333333333333333333333333333333333333333333333333333333333333333"
            }
          }
        ],
        "recommendation": "option_approve",
        "uncertainty": {
          "ref": "uncertainty_summary_fixture_01",
          "digest": "sha256:4444444444444444444444444444444444444444444444444444444444444444"
        },
        "evidence": [
          {
            "ref": "evidence_summary_fixture_01",
            "digest": "sha256:5555555555555555555555555555555555555555555555555555555555555555"
          }
        ],
        "costOfWaiting": {
          "ref": "cost_of_waiting_summary_fixture_01",
          "digest": "sha256:6666666666666666666666666666666666666666666666666666666666666666"
        },
        "risk": {
          "ref": "risk_summary_fixture_01",
          "digest": "sha256:7777777777777777777777777777777777777777777777777777777777777777"
        },
        "reversibility": {
          "ref": "reversibility_summary_fixture_01",
          "digest": "sha256:8888888888888888888888888888888888888888888888888888888888888888"
        },
        "affectedDigest": "sha256:9999999999999999999999999999999999999999999999999999999999999999",
        "requestedAuthority": {
          "purpose": "calendar.follow_up.schedule",
          "effectFamily": "calendar.event.create",
          "resources": [
            {
              "kind": "calendar",
              "ref": "calendar_primary"
            }
          ],
          "scopes": [
            "calendar.event.create"
          ],
          "audiences": [
            "calendar.account"
          ],
          "argumentDigest": "sha256:aaaaaaaaaaaaaaaaaaaaaaaaaaaaaaaaaaaaaaaaaaaaaaaaaaaaaaaaaaaaaaaa",
          "contextDigest": "sha256:bbbbbbbbbbbbbbbbbbbbbbbbbbbbbbbbbbbbbbbbbbbbbbbbbbbbbbbbbbbbbbbb",
          "artifactDigest": null,
          "useLimit": 1,
          "validUntil": "2026-08-15T18:30:00.000Z"
        },
        "authorityAdmission": {
          "grantee": {
            "kind": "service",
            "id": "effect_engine"
          },
          "ownerPolicyRevision": 7,
          "admissionContextDigest": "sha256:cccccccccccccccccccccccccccccccccccccccccccccccccccccccccccccccc"
        },
        "reEntryPointId": "reentry_fixture_01",
        "expiresAt": "2026-08-15T18:30:00.000Z",
        "decisionId": null,
        "state": "open",
        "createdAt": "2026-08-15T18:05:00.000Z",
        "updatedAt": "2026-08-15T18:05:00.000Z"
      },
      "displayedRequestDigest": "sha256:3271b4fb2ab9ec42f3db2a93a7f9ce65938df09c5ebd015f3505a65577a4601e"
    }
  ],
  "hasMore": true,
  "generatedAt": "2026-08-15T18:10:00.000Z"
}
